<?xml version="1.0"?>
<!DOCTYPE Report
[
<!ELEMENT Report (General ,(Doc|BPT)) >
<!ATTLIST Report ver CDATA #REQUIRED tmZone CDATA #REQUIRED>

<!ELEMENT General ( DocLocation ) >
<!ATTLIST General productName CDATA #REQUIRED productVer CDATA #REQUIRED os CDATA #REQUIRED host CDATA #REQUIRED qcserver CDATA #IMPLIED qcproject CDATA #IMPLIED SolManSolutionId CDATA #IMPLIED SolManProjectId CDATA #IMPLIED SolManTestPlanId CDATA #IMPLIED SolManTestPackageId CDATA #IMPLIED SolManUserInfoData CDATA #IMPLIED  >

<!ELEMENT BPT (DName,Res,DVer?,TSet?,TInst?,NodeArgs,AdditionalInfo*,Doc*) >
<!ATTLIST BPT rID ID #REQUIRED >

<!ELEMENT Doc (DName,ConfName?,Res,DVer?,TSet?,TInst?,RunType?,DT?,AdditionalInfo*,Step*,DIter*,Step*,Action*,Doc*,Summary?,TestMaintenanceSummary*,NodeArgs?) >
<!ATTLIST Doc rID ID #REQUIRED type (Test|BC|BPTWrapperTest|Flow|Group|Action) "Test" productName CDATA #REQUIRED BCIter CDATA #IMPLIED >

<!ELEMENT RunType ( #PCDATA )>
<!ATTLIST RunType fmStep (False|True) "False" batch (False|True) "False" upDesc (False|True) "False" upChk (False|True) "False" upAS (False|True) "False">

<!ELEMENT DName ( #PCDATA ) >

<!ELEMENT ConfName ( #PCDATA ) >

<!ELEMENT Res ( #PCDATA ) >

<!ELEMENT AdditionalInfo (AdditionalDataName,AdditionalDataValue ) >

<!ELEMENT AdditionalDataName ( #PCDATA ) >

<!ELEMENT AdditionalDataValue ( #PCDATA ) >

<!ELEMENT DVer ( #PCDATA ) >

<!ELEMENT TSet ( #PCDATA ) >

<!ELEMENT TInst ( #PCDATA ) >

<!ELEMENT DIter (Step*,Action+,Summary?,NodeArgs)>
<!ATTLIST DIter rID ID #REQUIRED iterID CDATA #REQUIRED>

<!ELEMENT DocLocation ( #PCDATA )>

<!ELEMENT Action (AName,AIter*,(Step|HtmlStep|Action)*, Summary,ActionMaintenanceSummary*, NodeArgs ) >
<!ATTLIST Action rID ID #REQUIRED>

<!ELEMENT AIter ((Step|HtmlStep|Action)*,DataMapping?, Summary?,NodeArgs) >
<!ATTLIST AIter rID ID #REQUIRED iterID CDATA #REQUIRED isCountable (False|True) "False" >

<!ELEMENT AName ( #PCDATA ) >

<!ELEMENT TestMaintenanceSummary (ActionMaintenanceSummary*) >
<!ATTLIST TestMaintenanceSummary ObjectsAdded CDATA #REQUIRED ObjectsUpdated CDATA #REQUIRED StepsUpdated CDATA #REQUIRED StepsComments CDATA #REQUIRED><!ELEMENT ActionMaintenanceSummary (ObjectChange* ) >
<!ATTLIST ActionMaintenanceSummary Action CDATA #REQUIRED Objects CDATA #REQUIRED Updated CDATA #REQUIRED LinesTotal CDATA #REQUIRED Added CDATA #REQUIRED LinesUpdated CDATA #REQUIRED>

<!ELEMENT ObjectChange  (Hierarchy, PropertyChangeList* ) >
<!ATTLIST ObjectChange Operation CDATA #IMPLIED OriginalRepository CDATA #IMPLIED>

<!ELEMENT PropertyChangeList (PropertyDef*) >

<!ELEMENT PropertyDef (OriginalValue, NewValue) >
<!ATTLIST PropertyDef PropName CDATA #REQUIRED OriginRegularExpression (True|False) "False" NewRegularExpression (True|False) "False" AddedProperty (True|False) "False" >

<!ELEMENT OriginalValue ( #PCDATA )>

<!ELEMENT NewValue ( #PCDATA )>

<!ELEMENT Hierarchy  (ObjectName, Hierarchy*) >
<!ATTLIST Hierarchy MicClass CDATA #REQUIRED>

<!ELEMENT ObjectName  ( #PCDATA ) >

<!ELEMENT Step (Obj,Details,Time,TimeTick* ,(Step|HtmlStep|Doc)*, DataMapping?, NodeArgs) >
<!ATTLIST Step rID ID #REQUIRED retval CDATA #IMPLIED>

<!ELEMENT HtmlStep (HTML,TimeTick*,(Step|HtmlStep|Doc)*,NodeArgs) >
<!ATTLIST HtmlStep rID ID #REQUIRED >

<!ELEMENT Obj ( #PCDATA ) >
<!ATTLIST Obj plainTxt (False|True) "True">

<!ELEMENT Details ( #PCDATA ) >
<!ATTLIST Details plainTxt (False|True) "True">

<!ELEMENT Time ( #PCDATA ) >

<!ELEMENT HTML ( #PCDATA ) >

<!ELEMENT Disp ( #PCDATA ) >

<!ELEMENT TimeTick ( #PCDATA ) >

<!ELEMENT DataMapping ( DataMappedItem* )>
<!ELEMENT DataMappedItem EMPTY >
<!ATTLIST DataMappedItem dsName CDATA #REQUIRED >
<!ATTLIST DataMappedItem rowId CDATA #REQUIRED >

<!ELEMENT NodeArgs (Disp,TopPane?,BtmPane?,ExtendedInfo? )>
<!ATTLIST NodeArgs eType CDATA #REQUIRED icon CDATA #REQUIRED nRep CDATA #REQUIRED UserNote CDATA #IMPLIED filter (False|True) "True">
<!ATTLIST NodeArgs status (Passed|Failed|Done|Warning|Information) "Done">
<!ATTLIST NodeArgs iconSel CDATA #IMPLIED nType CDATA #IMPLIED MovieMarker CDATA "">
<!ATTLIST NodeArgs Source CDATA #IMPLIED SourceLine CDATA #IMPLIED StepFlowItemKey CDATA #IMPLIED >

<!ELEMENT TopPane (Path)>

<!ELEMENT BtmPane ( (Path|WR)?,ASHilite?)>
<!ATTLIST BtmPane vType CDATA "HTML">

<!ELEMENT Path ( #PCDATA ) >

<!ELEMENT ASHilite ( #PCDATA ) >

<!ELEMENT WR ( #PCDATA ) >

<!ELEMENT ExtendedInfo ( StepData ) >

<!ATTLIST ExtendedInfo StepType CDATA #REQUIRED>
<!ELEMENT DT (NodeArgs) >
<!ATTLIST DT rID ID #REQUIRED>

<!ELEMENT Summary (Param*)>
<!ATTLIST Summary sTime CDATA #IMPLIED eTime CDATA #IMPLIED passed CDATA #IMPLIED failed CDATA #IMPLIED warnings CDATA #IMPLIED retval CDATA #IMPLIED stopped (False|True) "False" >

<!ELEMENT Param (ParamName,ParamVal)+ >
<!ATTLIST Param paramInOut (In|Out) "In">

<!ELEMENT ParamName ( #PCDATA ) >

<!ELEMENT ParamVal ( #PCDATA ) >

]
>
<Report ver="2.0" tmZone="India Standard Time">
<General productName="HPE Unified Functional Testing" productVer="14.02" os="Windows 7" host="INPUHJLP06355"><DocLocation><![CDATA[C:\Git_Repo\UFT_Octane_Test\OrangeHRM]]></DocLocation></General>
<Doc rID="T1"   productName= "HPE Unified Functional Testing"  >
<DName><![CDATA[OrangeHRM]]></DName>
<Res><![CDATA[OrangeHRM]]></Res>
<DT rID="T2">
<NodeArgs eType="Table" icon="13" nRep="4" filter="False" >
<Disp><![CDATA[Run-Time Data Table]]></Disp>
<BtmPane vType="Table" >
<Path><![CDATA[Default.xls]]></Path>
</BtmPane>
</NodeArgs>
</DT>
<DIter rID="T3" iterID="1" >
<Action rID="T4">
<AName><![CDATA[Action1]]></AName>
<Step rID="T5">
<Obj plainTxt="False" ><![CDATA[SystemUtil]]></Obj>
<Details plainTxt="False" ><![CDATA[SystemUtil]]></Details>
<Time><![CDATA[31/05/2018 - 20:04:04]]></Time>
<TimeTick>1527777244</TimeTick>
<Step rID="T6">
<Obj plainTxt="False" ><![CDATA[Run "firefox.exe",1]]></Obj>
<Details plainTxt="False" ><![CDATA[Run "firefox.exe",1]]></Details>
<Time><![CDATA[31/05/2018 - 20:04:04]]></Time>
<TimeTick>1527777244</TimeTick>
<NodeArgs eType="Replay" icon="16" nRep="11" status="Passed" Source="Action1" SourceLine="-1" >
<Disp><![CDATA[Run "firefox.exe",1]]></Disp>
</NodeArgs>
</Step>
<NodeArgs eType="Replay" icon="16" nRep="10" status="Passed" Source="Action1" SourceLine="-1" >
<Disp><![CDATA[SystemUtil]]></Disp>
</NodeArgs>
</Step>
<Step rID="T7">
<Obj plainTxt="False" ><![CDATA[[ WebButton ].Exist]]></Obj>
<Details plainTxt="False" ><![CDATA["Object does not exist"]]></Details>
<Time><![CDATA[31/05/2018 - 20:04:05]]></Time>
<TimeTick>1527777245</TimeTick>
<NodeArgs eType="Replay" icon="17" nRep="19" Source="Action1" SourceLine="-1" >
<Disp><![CDATA[[ WebButton ].Exist]]></Disp>
</NodeArgs>
</Step>
<Step rID="T8">
<Obj plainTxt="False" ><![CDATA[[ WebButton ].Exist]]></Obj>
<Details plainTxt="False" ><![CDATA["Object does not exist"]]></Details>
<Time><![CDATA[31/05/2018 - 20:04:07]]></Time>
<TimeTick>1527777247</TimeTick>
<NodeArgs eType="Replay" icon="17" nRep="27" Source="Action1" SourceLine="-1" >
<Disp><![CDATA[[ WebButton ].Exist]]></Disp>
</NodeArgs>
</Step>
<Step rID="T9">
<Obj plainTxt="False" ><![CDATA[[ WebButton ].Exist]]></Obj>
<Details plainTxt="False" ><![CDATA["Object does not exist"]]></Details>
<Time><![CDATA[31/05/2018 - 20:04:08]]></Time>
<TimeTick>1527777248</TimeTick>
<NodeArgs eType="Replay" icon="17" nRep="35" Source="Action1" SourceLine="-1" >
<Disp><![CDATA[[ WebButton ].Exist]]></Disp>
</NodeArgs>
</Step>
<Step rID="T10">
<Obj plainTxt="False" ><![CDATA[[ WebButton ].Exist]]></Obj>
<Details plainTxt="False" ><![CDATA["Object does not exist"]]></Details>
<Time><![CDATA[31/05/2018 - 20:04:09]]></Time>
<TimeTick>1527777249</TimeTick>
<NodeArgs eType="Replay" icon="17" nRep="43" Source="Action1" SourceLine="-1" >
<Disp><![CDATA[[ WebButton ].Exist]]></Disp>
</NodeArgs>
</Step>
<Step rID="T11">
<Obj plainTxt="False" ><![CDATA[[ WebButton ].Exist]]></Obj>
<Details plainTxt="False" ><![CDATA["Object does not exist"]]></Details>
<Time><![CDATA[31/05/2018 - 20:04:11]]></Time>
<TimeTick>1527777251</TimeTick>
<NodeArgs eType="Replay" icon="17" nRep="51" Source="Action1" SourceLine="-1" >
<Disp><![CDATA[[ WebButton ].Exist]]></Disp>
</NodeArgs>
</Step>
<Step rID="T12">
<Obj plainTxt="False" ><![CDATA[[ WebButton ].Exist]]></Obj>
<Details plainTxt="False" ><![CDATA["Object does not exist"]]></Details>
<Time><![CDATA[31/05/2018 - 20:04:12]]></Time>
<TimeTick>1527777252</TimeTick>
<NodeArgs eType="Replay" icon="17" nRep="59" Source="Action1" SourceLine="-1" >
<Disp><![CDATA[[ WebButton ].Exist]]></Disp>
</NodeArgs>
</Step>
<Step rID="T13">
<Obj plainTxt="False" ><![CDATA[[ WebButton ].Exist]]></Obj>
<Details plainTxt="False" ><![CDATA["Object does not exist"]]></Details>
<Time><![CDATA[31/05/2018 - 20:04:13]]></Time>
<TimeTick>1527777253</TimeTick>
<NodeArgs eType="Replay" icon="17" nRep="67" Source="Action1" SourceLine="-1" >
<Disp><![CDATA[[ WebButton ].Exist]]></Disp>
</NodeArgs>
</Step>
<Step rID="T14">
<Obj plainTxt="False" ><![CDATA[[ WebButton ].Exist]]></Obj>
<Details plainTxt="False" ><![CDATA["Object does not exist"]]></Details>
<Time><![CDATA[31/05/2018 - 20:04:15]]></Time>
<TimeTick>1527777255</TimeTick>
<NodeArgs eType="Replay" icon="17" nRep="75" Source="Action1" SourceLine="-1" >
<Disp><![CDATA[[ WebButton ].Exist]]></Disp>
</NodeArgs>
</Step>
<Step rID="T15">
<Obj plainTxt="False" ><![CDATA[[ WebButton ].Exist]]></Obj>
<Details plainTxt="False" ><![CDATA["Object does not exist"]]></Details>
<Time><![CDATA[31/05/2018 - 20:04:16]]></Time>
<TimeTick>1527777256</TimeTick>
<NodeArgs eType="Replay" icon="17" nRep="83" Source="Action1" SourceLine="-1" >
<Disp><![CDATA[[ WebButton ].Exist]]></Disp>
</NodeArgs>
</Step>
<Step rID="T16">
<Obj plainTxt="False" ><![CDATA[[ WebButton ].Exist]]></Obj>
<Details plainTxt="False" ><![CDATA["Object does not exist"]]></Details>
<Time><![CDATA[31/05/2018 - 20:04:20]]></Time>
<TimeTick>1527777260</TimeTick>
<NodeArgs eType="Replay" icon="17" nRep="91" Source="Action1" SourceLine="-1" >
<Disp><![CDATA[[ WebButton ].Exist]]></Disp>
</NodeArgs>
</Step>
<Step rID="T17">
<Obj plainTxt="False" ><![CDATA[[ WebButton ].Exist]]></Obj>
<Details plainTxt="False" ><![CDATA["Object does not exist"]]></Details>
<Time><![CDATA[31/05/2018 - 20:04:22]]></Time>
<TimeTick>1527777262</TimeTick>
<NodeArgs eType="Replay" icon="17" nRep="99" Source="Action1" SourceLine="-1" >
<Disp><![CDATA[[ WebButton ].Exist]]></Disp>
</NodeArgs>
</Step>
<Step rID="T18">
<Obj plainTxt="False" ><![CDATA[[ WebButton ].Exist]]></Obj>
<Details plainTxt="False" ><![CDATA["Object does not exist"]]></Details>
<Time><![CDATA[31/05/2018 - 20:04:23]]></Time>
<TimeTick>1527777263</TimeTick>
<NodeArgs eType="Replay" icon="17" nRep="107" Source="Action1" SourceLine="-1" >
<Disp><![CDATA[[ WebButton ].Exist]]></Disp>
</NodeArgs>
</Step>
<Step rID="T19">
<Obj plainTxt="False" ><![CDATA[[ WebButton ].Exist]]></Obj>
<Details plainTxt="False" ><![CDATA["Object does not exist"]]></Details>
<Time><![CDATA[31/05/2018 - 20:04:36]]></Time>
<TimeTick>1527777276</TimeTick>
<NodeArgs eType="Replay" icon="17" nRep="115" Source="Action1" SourceLine="-1" >
<Disp><![CDATA[[ WebButton ].Exist]]></Disp>
</NodeArgs>
</Step>
<Step rID="T20">
<Obj plainTxt="False" ><![CDATA[[ WebButton ].Exist]]></Obj>
<Details plainTxt="False" ><![CDATA["Object does not exist"]]></Details>
<Time><![CDATA[31/05/2018 - 20:04:38]]></Time>
<TimeTick>1527777278</TimeTick>
<NodeArgs eType="Replay" icon="17" nRep="123" Source="Action1" SourceLine="-1" >
<Disp><![CDATA[[ WebButton ].Exist]]></Disp>
</NodeArgs>
</Step>
<Step rID="T21">
<Obj plainTxt="False" ><![CDATA[[ WebButton ].Exist]]></Obj>
<Details plainTxt="False" ><![CDATA["Object does not exist"]]></Details>
<Time><![CDATA[31/05/2018 - 20:04:40]]></Time>
<TimeTick>1527777280</TimeTick>
<NodeArgs eType="Replay" icon="17" nRep="131" Source="Action1" SourceLine="-1" >
<Disp><![CDATA[[ WebButton ].Exist]]></Disp>
</NodeArgs>
</Step>
<Step rID="T22">
<Obj plainTxt="False" ><![CDATA[[ WebButton ].Exist]]></Obj>
<Details plainTxt="False" ><![CDATA["Object does not exist"]]></Details>
<Time><![CDATA[31/05/2018 - 20:04:41]]></Time>
<TimeTick>1527777281</TimeTick>
<NodeArgs eType="Replay" icon="17" nRep="139" Source="Action1" SourceLine="-1" >
<Disp><![CDATA[[ WebButton ].Exist]]></Disp>
</NodeArgs>
</Step>
<Step rID="T23">
<Obj plainTxt="False" ><![CDATA[[ WebButton ].Exist]]></Obj>
<Details plainTxt="False" ><![CDATA["Object does not exist"]]></Details>
<Time><![CDATA[31/05/2018 - 20:04:42]]></Time>
<TimeTick>1527777282</TimeTick>
<NodeArgs eType="Replay" icon="17" nRep="147" Source="Action1" SourceLine="-1" >
<Disp><![CDATA[[ WebButton ].Exist]]></Disp>
</NodeArgs>
</Step>
<Step rID="T24">
<Obj plainTxt="False" ><![CDATA[[ WebButton ].Exist]]></Obj>
<Details plainTxt="False" ><![CDATA["Object does not exist"]]></Details>
<Time><![CDATA[31/05/2018 - 20:04:44]]></Time>
<TimeTick>1527777284</TimeTick>
<NodeArgs eType="Replay" icon="17" nRep="155" Source="Action1" SourceLine="-1" >
<Disp><![CDATA[[ WebButton ].Exist]]></Disp>
</NodeArgs>
</Step>
<Step rID="T25">
<Obj plainTxt="False" ><![CDATA[[ WebButton ].Exist]]></Obj>
<Details plainTxt="False" ><![CDATA["Object does not exist"]]></Details>
<Time><![CDATA[31/05/2018 - 20:04:45]]></Time>
<TimeTick>1527777285</TimeTick>
<NodeArgs eType="Replay" icon="17" nRep="163" Source="Action1" SourceLine="-1" >
<Disp><![CDATA[[ WebButton ].Exist]]></Disp>
</NodeArgs>
</Step>
<Step rID="T26">
<Obj plainTxt="False" ><![CDATA[[ WebButton ].Exist]]></Obj>
<Details plainTxt="False" ><![CDATA["Object does not exist"]]></Details>
<Time><![CDATA[31/05/2018 - 20:04:47]]></Time>
<TimeTick>1527777287</TimeTick>
<NodeArgs eType="Replay" icon="17" nRep="171" Source="Action1" SourceLine="-1" >
<Disp><![CDATA[[ WebButton ].Exist]]></Disp>
</NodeArgs>
</Step>
<Step rID="T27">
<Obj plainTxt="False" ><![CDATA[[ WebButton ].Exist]]></Obj>
<Details plainTxt="False" ><![CDATA["Object does not exist"]]></Details>
<Time><![CDATA[31/05/2018 - 20:04:48]]></Time>
<TimeTick>1527777288</TimeTick>
<NodeArgs eType="Replay" icon="17" nRep="179" Source="Action1" SourceLine="-1" >
<Disp><![CDATA[[ WebButton ].Exist]]></Disp>
</NodeArgs>
</Step>
<Step rID="T28">
<Obj plainTxt="False" ><![CDATA[[ WebButton ].Exist]]></Obj>
<Details plainTxt="False" ><![CDATA["Object does not exist"]]></Details>
<Time><![CDATA[31/05/2018 - 20:04:49]]></Time>
<TimeTick>1527777289</TimeTick>
<NodeArgs eType="Replay" icon="17" nRep="187" Source="Action1" SourceLine="-1" >
<Disp><![CDATA[[ WebButton ].Exist]]></Disp>
</NodeArgs>
</Step>
<Step rID="T29">
<Obj plainTxt="False" ><![CDATA[[ WebButton ].Exist]]></Obj>
<Details plainTxt="False" ><![CDATA["Object does not exist"]]></Details>
<Time><![CDATA[31/05/2018 - 20:04:51]]></Time>
<TimeTick>1527777291</TimeTick>
<NodeArgs eType="Replay" icon="17" nRep="195" Source="Action1" SourceLine="-1" >
<Disp><![CDATA[[ WebButton ].Exist]]></Disp>
</NodeArgs>
</Step>
<Step rID="T30">
<Obj plainTxt="False" ><![CDATA[[ WebButton ].Exist]]></Obj>
<Details plainTxt="False" ><![CDATA["Object does not exist"]]></Details>
<Time><![CDATA[31/05/2018 - 20:04:52]]></Time>
<TimeTick>1527777292</TimeTick>
<NodeArgs eType="Replay" icon="17" nRep="203" Source="Action1" SourceLine="-1" >
<Disp><![CDATA[[ WebButton ].Exist]]></Disp>
</NodeArgs>
</Step>
<Step rID="T31">
<Obj plainTxt="False" ><![CDATA[[ WebButton ].Exist]]></Obj>
<Details plainTxt="False" ><![CDATA["Object does not exist"]]></Details>
<Time><![CDATA[31/05/2018 - 20:04:53]]></Time>
<TimeTick>1527777293</TimeTick>
<NodeArgs eType="Replay" icon="17" nRep="211" Source="Action1" SourceLine="-1" >
<Disp><![CDATA[[ WebButton ].Exist]]></Disp>
</NodeArgs>
</Step>
<Step rID="T32">
<Obj plainTxt="False" ><![CDATA[[ WebButton ].Exist]]></Obj>
<Details plainTxt="False" ><![CDATA["Object does not exist"]]></Details>
<Time><![CDATA[31/05/2018 - 20:04:55]]></Time>
<TimeTick>1527777295</TimeTick>
<NodeArgs eType="Replay" icon="17" nRep="219" Source="Action1" SourceLine="-1" >
<Disp><![CDATA[[ WebButton ].Exist]]></Disp>
</NodeArgs>
</Step>
<Step rID="T33">
<Obj plainTxt="False" ><![CDATA[[ WebButton ].Exist]]></Obj>
<Details plainTxt="False" ><![CDATA["Object does not exist"]]></Details>
<Time><![CDATA[31/05/2018 - 20:04:56]]></Time>
<TimeTick>1527777296</TimeTick>
<NodeArgs eType="Replay" icon="17" nRep="227" Source="Action1" SourceLine="-1" >
<Disp><![CDATA[[ WebButton ].Exist]]></Disp>
</NodeArgs>
</Step>
<Step rID="T34">
<Obj plainTxt="False" ><![CDATA[[ WebButton ].Exist]]></Obj>
<Details plainTxt="False" ><![CDATA["Object does not exist"]]></Details>
<Time><![CDATA[31/05/2018 - 20:04:57]]></Time>
<TimeTick>1527777297</TimeTick>
<NodeArgs eType="Replay" icon="17" nRep="235" Source="Action1" SourceLine="-1" >
<Disp><![CDATA[[ WebButton ].Exist]]></Disp>
</NodeArgs>
</Step>
<Step rID="T35">
<Obj plainTxt="False" ><![CDATA[[ WebButton ].Exist]]></Obj>
<Details plainTxt="False" ><![CDATA["Object does not exist"]]></Details>
<Time><![CDATA[31/05/2018 - 20:04:59]]></Time>
<TimeTick>1527777299</TimeTick>
<NodeArgs eType="Replay" icon="17" nRep="243" Source="Action1" SourceLine="-1" >
<Disp><![CDATA[[ WebButton ].Exist]]></Disp>
</NodeArgs>
</Step>
<Step rID="T36">
<Obj plainTxt="False" ><![CDATA[[ WebButton ].Exist]]></Obj>
<Details plainTxt="False" ><![CDATA["Object does not exist"]]></Details>
<Time><![CDATA[31/05/2018 - 20:05:00]]></Time>
<TimeTick>1527777300</TimeTick>
<NodeArgs eType="Replay" icon="17" nRep="251" Source="Action1" SourceLine="-1" >
<Disp><![CDATA[[ WebButton ].Exist]]></Disp>
</NodeArgs>
</Step>
<Step rID="T37">
<Obj plainTxt="False" ><![CDATA[[ WebButton ].Exist]]></Obj>
<Details plainTxt="False" ><![CDATA["Object does not exist"]]></Details>
<Time><![CDATA[31/05/2018 - 20:05:01]]></Time>
<TimeTick>1527777301</TimeTick>
<NodeArgs eType="Replay" icon="17" nRep="259" Source="Action1" SourceLine="-1" >
<Disp><![CDATA[[ WebButton ].Exist]]></Disp>
</NodeArgs>
</Step>
<Step rID="T38">
<Obj plainTxt="False" ><![CDATA[[ WebButton ].Exist]]></Obj>
<Details plainTxt="False" ><![CDATA["Object does not exist"]]></Details>
<Time><![CDATA[31/05/2018 - 20:05:03]]></Time>
<TimeTick>1527777303</TimeTick>
<NodeArgs eType="Replay" icon="17" nRep="267" Source="Action1" SourceLine="-1" >
<Disp><![CDATA[[ WebButton ].Exist]]></Disp>
</NodeArgs>
</Step>
<Step rID="T39">
<Obj plainTxt="False" ><![CDATA[[ WebButton ].Exist]]></Obj>
<Details plainTxt="False" ><![CDATA["Object does not exist"]]></Details>
<Time><![CDATA[31/05/2018 - 20:05:04]]></Time>
<TimeTick>1527777304</TimeTick>
<NodeArgs eType="Replay" icon="17" nRep="275" Source="Action1" SourceLine="-1" >
<Disp><![CDATA[[ WebButton ].Exist]]></Disp>
</NodeArgs>
</Step>
<Step rID="T40">
<Obj plainTxt="False" ><![CDATA[[ WebButton ].Exist]]></Obj>
<Details plainTxt="False" ><![CDATA["Object does not exist"]]></Details>
<Time><![CDATA[31/05/2018 - 20:05:05]]></Time>
<TimeTick>1527777305</TimeTick>
<NodeArgs eType="Replay" icon="17" nRep="283" Source="Action1" SourceLine="-1" >
<Disp><![CDATA[[ WebButton ].Exist]]></Disp>
</NodeArgs>
</Step>
<Step rID="T41">
<Obj plainTxt="False" ><![CDATA[[ WebButton ].Exist]]></Obj>
<Details plainTxt="False" ><![CDATA["Object does not exist"]]></Details>
<Time><![CDATA[31/05/2018 - 20:05:07]]></Time>
<TimeTick>1527777307</TimeTick>
<NodeArgs eType="Replay" icon="17" nRep="291" Source="Action1" SourceLine="-1" >
<Disp><![CDATA[[ WebButton ].Exist]]></Disp>
</NodeArgs>
</Step>
<Step rID="T42">
<Obj plainTxt="False" ><![CDATA[[ WebButton ].Exist]]></Obj>
<Details plainTxt="False" ><![CDATA["Object does not exist"]]></Details>
<Time><![CDATA[31/05/2018 - 20:05:08]]></Time>
<TimeTick>1527777308</TimeTick>
<NodeArgs eType="Replay" icon="17" nRep="299" Source="Action1" SourceLine="-1" >
<Disp><![CDATA[[ WebButton ].Exist]]></Disp>
</NodeArgs>
</Step>
<Step rID="T43">
<Obj plainTxt="False" ><![CDATA[[ WebButton ].Exist]]></Obj>
<Details plainTxt="False" ><![CDATA["Object does not exist"]]></Details>
<Time><![CDATA[31/05/2018 - 20:05:09]]></Time>
<TimeTick>1527777309</TimeTick>
<NodeArgs eType="Replay" icon="17" nRep="307" Source="Action1" SourceLine="-1" >
<Disp><![CDATA[[ WebButton ].Exist]]></Disp>
</NodeArgs>
</Step>
<Step rID="T44">
<Obj plainTxt="False" ><![CDATA[[ WebButton ].Exist]]></Obj>
<Details plainTxt="False" ><![CDATA["Object does not exist"]]></Details>
<Time><![CDATA[31/05/2018 - 20:05:11]]></Time>
<TimeTick>1527777311</TimeTick>
<NodeArgs eType="Replay" icon="17" nRep="315" Source="Action1" SourceLine="-1" >
<Disp><![CDATA[[ WebButton ].Exist]]></Disp>
</NodeArgs>
</Step>
<Step rID="T45">
<Obj plainTxt="False" ><![CDATA[[ WebButton ].Exist]]></Obj>
<Details plainTxt="False" ><![CDATA["Object does not exist"]]></Details>
<Time><![CDATA[31/05/2018 - 20:05:12]]></Time>
<TimeTick>1527777312</TimeTick>
<NodeArgs eType="Replay" icon="17" nRep="323" Source="Action1" SourceLine="-1" >
<Disp><![CDATA[[ WebButton ].Exist]]></Disp>
</NodeArgs>
</Step>
<Step rID="T46">
<Obj plainTxt="False" ><![CDATA[[ WebButton ].Exist]]></Obj>
<Details plainTxt="False" ><![CDATA["Object does not exist"]]></Details>
<Time><![CDATA[31/05/2018 - 20:05:13]]></Time>
<TimeTick>1527777313</TimeTick>
<NodeArgs eType="Replay" icon="17" nRep="331" Source="Action1" SourceLine="-1" >
<Disp><![CDATA[[ WebButton ].Exist]]></Disp>
</NodeArgs>
</Step>
<Step rID="T47">
<Obj plainTxt="False" ><![CDATA[[ WebButton ].Exist]]></Obj>
<Details plainTxt="False" ><![CDATA["Object does not exist"]]></Details>
<Time><![CDATA[31/05/2018 - 20:05:15]]></Time>
<TimeTick>1527777315</TimeTick>
<NodeArgs eType="Replay" icon="17" nRep="339" Source="Action1" SourceLine="-1" >
<Disp><![CDATA[[ WebButton ].Exist]]></Disp>
</NodeArgs>
</Step>
<Step rID="T48">
<Obj plainTxt="False" ><![CDATA[[ WebButton ].Exist]]></Obj>
<Details plainTxt="False" ><![CDATA["Object does not exist"]]></Details>
<Time><![CDATA[31/05/2018 - 20:05:16]]></Time>
<TimeTick>1527777316</TimeTick>
<NodeArgs eType="Replay" icon="17" nRep="347" Source="Action1" SourceLine="-1" >
<Disp><![CDATA[[ WebButton ].Exist]]></Disp>
</NodeArgs>
</Step>
<Step rID="T49">
<Obj plainTxt="False" ><![CDATA[[ WebButton ].Exist]]></Obj>
<Details plainTxt="False" ><![CDATA["Object does not exist"]]></Details>
<Time><![CDATA[31/05/2018 - 20:05:17]]></Time>
<TimeTick>1527777317</TimeTick>
<NodeArgs eType="Replay" icon="17" nRep="355" Source="Action1" SourceLine="-1" >
<Disp><![CDATA[[ WebButton ].Exist]]></Disp>
</NodeArgs>
</Step>
<Step rID="T50">
<Obj plainTxt="False" ><![CDATA[[ WebButton ].Exist]]></Obj>
<Details plainTxt="False" ><![CDATA["Object does not exist"]]></Details>
<Time><![CDATA[31/05/2018 - 20:05:19]]></Time>
<TimeTick>1527777319</TimeTick>
<NodeArgs eType="Replay" icon="17" nRep="363" Source="Action1" SourceLine="-1" >
<Disp><![CDATA[[ WebButton ].Exist]]></Disp>
</NodeArgs>
</Step>
<Step rID="T51">
<Obj plainTxt="False" ><![CDATA[[ WebButton ].Exist]]></Obj>
<Details plainTxt="False" ><![CDATA["Object does not exist"]]></Details>
<Time><![CDATA[31/05/2018 - 20:05:20]]></Time>
<TimeTick>1527777320</TimeTick>
<NodeArgs eType="Replay" icon="17" nRep="371" Source="Action1" SourceLine="-1" >
<Disp><![CDATA[[ WebButton ].Exist]]></Disp>
</NodeArgs>
</Step>
<Step rID="T52">
<Obj plainTxt="False" ><![CDATA[[ WebButton ].Exist]]></Obj>
<Details plainTxt="False" ><![CDATA["Object does not exist"]]></Details>
<Time><![CDATA[31/05/2018 - 20:05:21]]></Time>
<TimeTick>1527777321</TimeTick>
<NodeArgs eType="Replay" icon="17" nRep="379" Source="Action1" SourceLine="-1" >
<Disp><![CDATA[[ WebButton ].Exist]]></Disp>
</NodeArgs>
</Step>
<Step rID="T53">
<Obj plainTxt="False" ><![CDATA[[ WebButton ].Exist]]></Obj>
<Details plainTxt="False" ><![CDATA["Object does not exist"]]></Details>
<Time><![CDATA[31/05/2018 - 20:05:23]]></Time>
<TimeTick>1527777323</TimeTick>
<NodeArgs eType="Replay" icon="17" nRep="387" Source="Action1" SourceLine="-1" >
<Disp><![CDATA[[ WebButton ].Exist]]></Disp>
</NodeArgs>
</Step>
<Step rID="T54">
<Obj plainTxt="False" ><![CDATA[[ WebButton ].Exist]]></Obj>
<Details plainTxt="False" ><![CDATA["Object does not exist"]]></Details>
<Time><![CDATA[31/05/2018 - 20:05:24]]></Time>
<TimeTick>1527777324</TimeTick>
<NodeArgs eType="Replay" icon="17" nRep="395" Source="Action1" SourceLine="-1" >
<Disp><![CDATA[[ WebButton ].Exist]]></Disp>
</NodeArgs>
</Step>
<Step rID="T55">
<Obj plainTxt="False" ><![CDATA[[ WebButton ].Exist]]></Obj>
<Details plainTxt="False" ><![CDATA["Object does not exist"]]></Details>
<Time><![CDATA[31/05/2018 - 20:05:26]]></Time>
<TimeTick>1527777326</TimeTick>
<NodeArgs eType="Replay" icon="17" nRep="403" Source="Action1" SourceLine="-1" >
<Disp><![CDATA[[ WebButton ].Exist]]></Disp>
</NodeArgs>
</Step>
<Step rID="T56">
<Obj plainTxt="False" ><![CDATA[[ WebButton ].Exist]]></Obj>
<Details plainTxt="False" ><![CDATA["Object does not exist"]]></Details>
<Time><![CDATA[31/05/2018 - 20:05:27]]></Time>
<TimeTick>1527777327</TimeTick>
<NodeArgs eType="Replay" icon="17" nRep="411" Source="Action1" SourceLine="-1" >
<Disp><![CDATA[[ WebButton ].Exist]]></Disp>
</NodeArgs>
</Step>
<Step rID="T57">
<Obj plainTxt="False" ><![CDATA[[ WebButton ].Exist]]></Obj>
<Details plainTxt="False" ><![CDATA["Object does not exist"]]></Details>
<Time><![CDATA[31/05/2018 - 20:05:28]]></Time>
<TimeTick>1527777328</TimeTick>
<NodeArgs eType="Replay" icon="17" nRep="419" Source="Action1" SourceLine="-1" >
<Disp><![CDATA[[ WebButton ].Exist]]></Disp>
</NodeArgs>
</Step>
<Step rID="T58">
<Obj plainTxt="False" ><![CDATA[[ WebButton ].Exist]]></Obj>
<Details plainTxt="False" ><![CDATA["Object does not exist"]]></Details>
<Time><![CDATA[31/05/2018 - 20:05:30]]></Time>
<TimeTick>1527777330</TimeTick>
<NodeArgs eType="Replay" icon="17" nRep="427" Source="Action1" SourceLine="-1" >
<Disp><![CDATA[[ WebButton ].Exist]]></Disp>
</NodeArgs>
</Step>
<Step rID="T59">
<Obj plainTxt="False" ><![CDATA[[ WebButton ].Exist]]></Obj>
<Details plainTxt="False" ><![CDATA["Object does not exist"]]></Details>
<Time><![CDATA[31/05/2018 - 20:05:31]]></Time>
<TimeTick>1527777331</TimeTick>
<NodeArgs eType="Replay" icon="17" nRep="435" Source="Action1" SourceLine="-1" >
<Disp><![CDATA[[ WebButton ].Exist]]></Disp>
</NodeArgs>
</Step>
<Step rID="T60">
<Obj plainTxt="False" ><![CDATA[[ WebButton ].Exist]]></Obj>
<Details plainTxt="False" ><![CDATA["Object does not exist"]]></Details>
<Time><![CDATA[31/05/2018 - 20:05:32]]></Time>
<TimeTick>1527777332</TimeTick>
<NodeArgs eType="Replay" icon="17" nRep="443" Source="Action1" SourceLine="-1" >
<Disp><![CDATA[[ WebButton ].Exist]]></Disp>
</NodeArgs>
</Step>
<Step rID="T61">
<Obj plainTxt="False" ><![CDATA[[ WebButton ].Exist]]></Obj>
<Details plainTxt="False" ><![CDATA["Object does not exist"]]></Details>
<Time><![CDATA[31/05/2018 - 20:05:34]]></Time>
<TimeTick>1527777334</TimeTick>
<NodeArgs eType="Replay" icon="17" nRep="451" Source="Action1" SourceLine="-1" >
<Disp><![CDATA[[ WebButton ].Exist]]></Disp>
</NodeArgs>
</Step>
<Step rID="T62">
<Obj plainTxt="False" ><![CDATA[[ WebButton ].Exist]]></Obj>
<Details plainTxt="False" ><![CDATA["Object does not exist"]]></Details>
<Time><![CDATA[31/05/2018 - 20:05:35]]></Time>
<TimeTick>1527777335</TimeTick>
<NodeArgs eType="Replay" icon="17" nRep="459" Source="Action1" SourceLine="-1" >
<Disp><![CDATA[[ WebButton ].Exist]]></Disp>
</NodeArgs>
</Step>
<Step rID="T63">
<Obj plainTxt="False" ><![CDATA[[ WebButton ].Exist]]></Obj>
<Details plainTxt="False" ><![CDATA["Object does not exist"]]></Details>
<Time><![CDATA[31/05/2018 - 20:05:36]]></Time>
<TimeTick>1527777336</TimeTick>
<NodeArgs eType="Replay" icon="17" nRep="467" Source="Action1" SourceLine="-1" >
<Disp><![CDATA[[ WebButton ].Exist]]></Disp>
</NodeArgs>
</Step>
<Step rID="T64">
<Obj plainTxt="False" ><![CDATA[[ WebButton ].Exist]]></Obj>
<Details plainTxt="False" ><![CDATA["Object does not exist"]]></Details>
<Time><![CDATA[31/05/2018 - 20:05:38]]></Time>
<TimeTick>1527777338</TimeTick>
<NodeArgs eType="Replay" icon="17" nRep="475" Source="Action1" SourceLine="-1" >
<Disp><![CDATA[[ WebButton ].Exist]]></Disp>
</NodeArgs>
</Step>
<Step rID="T65">
<Obj plainTxt="False" ><![CDATA[[ WebButton ].Exist]]></Obj>
<Details plainTxt="False" ><![CDATA["Object does not exist"]]></Details>
<Time><![CDATA[31/05/2018 - 20:05:39]]></Time>
<TimeTick>1527777339</TimeTick>
<NodeArgs eType="Replay" icon="17" nRep="483" Source="Action1" SourceLine="-1" >
<Disp><![CDATA[[ WebButton ].Exist]]></Disp>
</NodeArgs>
</Step>
<Step rID="T66">
<Obj plainTxt="False" ><![CDATA[[ WebButton ].Exist]]></Obj>
<Details plainTxt="False" ><![CDATA["Object does not exist"]]></Details>
<Time><![CDATA[31/05/2018 - 20:05:40]]></Time>
<TimeTick>1527777340</TimeTick>
<NodeArgs eType="Replay" icon="17" nRep="491" Source="Action1" SourceLine="-1" >
<Disp><![CDATA[[ WebButton ].Exist]]></Disp>
</NodeArgs>
</Step>
<Step rID="T67">
<Obj plainTxt="False" ><![CDATA[[ WebButton ].Exist]]></Obj>
<Details plainTxt="False" ><![CDATA["Object does not exist"]]></Details>
<Time><![CDATA[31/05/2018 - 20:05:42]]></Time>
<TimeTick>1527777342</TimeTick>
<NodeArgs eType="Replay" icon="17" nRep="499" Source="Action1" SourceLine="-1" >
<Disp><![CDATA[[ WebButton ].Exist]]></Disp>
</NodeArgs>
</Step>
<Step rID="T68">
<Obj plainTxt="False" ><![CDATA[[ WebButton ].Exist]]></Obj>
<Details plainTxt="False" ><![CDATA["Object does not exist"]]></Details>
<Time><![CDATA[31/05/2018 - 20:05:43]]></Time>
<TimeTick>1527777343</TimeTick>
<NodeArgs eType="Replay" icon="17" nRep="507" Source="Action1" SourceLine="-1" >
<Disp><![CDATA[[ WebButton ].Exist]]></Disp>
</NodeArgs>
</Step>
<Step rID="T69">
<Obj plainTxt="False" ><![CDATA[[ WebButton ].Exist]]></Obj>
<Details plainTxt="False" ><![CDATA["Object does not exist"]]></Details>
<Time><![CDATA[31/05/2018 - 20:05:44]]></Time>
<TimeTick>1527777344</TimeTick>
<NodeArgs eType="Replay" icon="17" nRep="515" Source="Action1" SourceLine="-1" >
<Disp><![CDATA[[ WebButton ].Exist]]></Disp>
</NodeArgs>
</Step>
<Step rID="T70">